Book Name,Author,Rating,Customers_Rated,Price
My First Library: Boxset of 10 Board Books for Kids,Wonder House Books,4.5 out of 5 stars,"28,212",₹399.00
The Psychology of Money,Morgan Housel,4.6 out of 5 stars,"12,345",₹269.00
Ikigai: The Japanese secret to a long and happy life,Héctor García,4.6 out of 5 stars,"17,374",₹308.00
My First Book of Pencil Control : Practice Pattern Writing (Full Color Pages): Patterns Practice book for kids (Pattern…,Wonder House Books,4.4 out of 5 stars,"7,196",₹89.00
Atomic Habits: The life-changing million copy bestseller,James Clear,4.6 out of 5 stars,"22,094",₹434.00
Rich Dad Poor Dad: What the Rich Teach Their Kids About Money That the Poor and Middle Class Do Not!,Robert T. Kiyosaki,4.6 out of 5 stars,"43,808",₹335.00
Word Power Made Easy,Norman Lewis,4.4 out of 5 stars,"23,409",₹89.00
The Alchemist,Paulo Coelho,4.6 out of 5 stars,"58,710",₹191.00
"Grandma's Bag of Stories: Collection of 20+ Illustrated short stories, traditional Indian folk tales for all ages for…",Sudha Murty,4.6 out of 5 stars,"6,734",₹191.00
Sapiens: A Brief History of Humankind,Yuval Noah Harari,4.7 out of 5 stars,"35,110",₹356.00
101 Panchatantra Stories for Children: Colourful Illustrated Stories,Om Books Editorial Team,4.5 out of 5 stars,"1,957",₹135.00
Picture Books Collection for Early Learning (Set of 12),E C Axus,4.2 out of 5 stars,"7,456",₹229.00
Quantitative Aptitude for Competitive Examinations,R S Aggarwal,4.4 out of 5 stars,"14,103",₹470.00
As a Man Thinketh,James Allen,4.4 out of 5 stars,"2,766",₹59.00
"Karma: A Yogi's Guide to Crafting Your Destiny NEW YORK TIMES, USA TODAY, and PUBLISHERS WEEKLY BESTSELLER , must-read…",Sadhguru,4.7 out of 5 stars,"2,021",₹199.00
Sach Kahun Toh: An Autobiography,Neena Gupta,4.3 out of 5 stars,93,₹382.00
Indian Polity - For Civil Services and Other State Examinations | 6th Edition,M. Laxmikanth,4.6 out of 5 stars,"11,253",₹605.00
Very First Sight Words Sentences Level - 1,Dreamland Publications,4.5 out of 5 stars,"4,289",₹140.00
Light on Yoga: The Classic Guide to Yoga by the World's Foremost Authority,B.K.S. Iyengar,4.5 out of 5 stars,"1,891",₹372.00
Oxford Student Atlas for India - Third Edition,Oxford University Press,4.6 out of 5 stars,"7,191",₹218.00
World’s Greatest Books For Personal Growth & Wealth (Set of 4 Books): Perfect Motivational Gift Set,Dale Carnegie,4.5 out of 5 stars,"8,420",₹299.00
The Blue Umbrella,Ruskin Bond,4.5 out of 5 stars,"5,768",₹69.00
Objective NCERT at your FINGERTIPS for NEET-AIIMS - Biology,MTG Editorial Board,4.6 out of 5 stars,"2,422",₹578.00
Great Stories for Children,Ruskin Bond,4.5 out of 5 stars,"5,104",₹141.00
The Lover Boy of Bahawalpur : How the Pulwama Case was Cracked,Rahul Pandita,4.4 out of 5 stars,24,₹399.00
Moral Story Books for Kids (Pack of 10 Books) | 160 Total Pages | Illustrated Stories,Young Angels Publishing,4.3 out of 5 stars,949,₹225.00
Capital Letters ABC: Write and practice Capital Letters A to Z book for kids (Writing Fun),Wonder House Books,4.3 out of 5 stars,"1,319",₹42.00
26 Years UPSC IAS/ IPS Prelims Topic-wise Solved Papers 1 & 2 (1995 - 2020) 11th Edition,Mrunal Patel,4.5 out of 5 stars,"3,033",₹318.00
Man's Search For Meaning: The classic tribute to hope from the Holocaust,Viktor E Frankl,4.5 out of 5 stars,"33,015",₹209.00
One Arranged Murder,Chetan Bhagat,4.3 out of 5 stars,"11,169",₹144.00
Life's Amazing Secrets: How to Find Balance and Purpose in Your Life,Gaur Gopal Das,4.6 out of 5 stars,"8,900",₹170.00
Attitude Is Everything: Change Your Attitude ... Change Your Life!,Jeff Keller,4.5 out of 5 stars,"10,361",₹153.00
Colour with Crayons Part - 1,Dreamland Publications,4.2 out of 5 stars,"2,942",₹56.00
My Activity- ABC Writing Book,Dreamland Publications,4.4 out of 5 stars,"1,496",₹65.00
Lines and Curves (Pattern Writing) - Part 1,Dreamland Publications,4.4 out of 5 stars,"3,396",₹65.00
A Modern Approach to Verbal & Non-Verbal Reasoning (2 Colour Edition),R.S. Aggarwal,4.4 out of 5 stars,"6,177",₹529.00
The Richest Man in Babylon,George S. Clason,4.5 out of 5 stars,"19,305",₹99.00
The Monk Who Sold His Ferrari,Robin Sharma,4.5 out of 5 stars,"15,038",₹146.00
General Knowledge,Dr. Binay Karna,4.4 out of 5 stars,"12,956",₹165.00
The Intelligent Investor (English) Paperback – 2013,Benjamin Graham,4.5 out of 5 stars,"25,599",₹488.00
Best of Children’s Classics (Set of 5 Books): Perfect Gift Set for Kids,Antoine de Saint-Exupéry,4.4 out of 5 stars,961,₹499.00
Think Like a Monk: The secret of how to harness the power of positivity and be happy now,Jay Shetty,4.7 out of 5 stars,"15,275",₹299.00
The 12-Week Fitness Project (Updated for 2021 with 12 Extra Guidelines),Rujuta Diwekar,4.4 out of 5 stars,121,₹195.00
"My First Mythology Tale (Illustrated) (Set of 5 Books) - Mahabharata, Krishna, Hanuman, Ganesha, Ramayana - Story Book…",Maple Press,4.4 out of 5 stars,679,₹151.00
Wuthering Heights,Emily Brontë,4.5 out of 5 stars,"12,213",₹99.00
My Big Book of Creative Crayons,Wonder House Books,4.4 out of 5 stars,216,₹149.00
The Power of Your Subconscious Mind,Joseph Murphy,4.5 out of 5 stars,"34,945",₹141.00
A Brief History of Modern India - 2020-21/edition,Rajiv Ahir,4.4 out of 5 stars,821,₹244.00
"The Magic of the Lost Temple: Illustrated, easy to read and much-loved first full length children’s fiction novel by…",Sudha Murty,4.7 out of 5 stars,"3,082",₹144.00
The Subtle Art of Not Giving a F*ck: A Counterintuitive Approach to Living a Good Life,Mark Manson,4.5 out of 5 stars,"50,150",₹325.00
How to Prepare for QUANTITATIVE APTITUDE for CAT | 9th Edition,Arun Sharma,4.7 out of 5 stars,36,₹740.00
Pride & Prejudice,Jane Austen,4.5 out of 5 stars,"21,521",₹101.00
"The 5 AM Club: Own Your Morning, Elevate Your Life",Robin Sharma,4.5 out of 5 stars,"13,298",₹225.00
The Power of your Subconscious Mind,Joseph Murphy,4.5 out of 5 stars,"34,945",₹149.00
Peppa Pig: Little Library,Peppa Pig,4.3 out of 5 stars,"14,278",₹196.00
"Don't Lose Your Mind, Lose Your Weight",Rujuta Diwekar,4.4 out of 5 stars,"4,454",₹178.00
My Activity- ABC Colouring Book,Dreamland Publications,4.4 out of 5 stars,"2,043",₹78.00
Mathematics for Class 10 by R D Sharma (Examination 2021-22),R.D. Sharma,4.6 out of 5 stars,"2,317",₹432.00
My First Complete Learning Library: Boxset of 20 Board Books Gift Set for Kids (Horizontal Design),Wonder House Books,4.6 out of 5 stars,"5,427",₹790.00
"The Silent Patient: The record-breaking, multimillion copy Sunday Times bestselling thriller and Richard & Judy book…",Alex Michaelides,4.5 out of 5 stars,"74,049",₹294.00
Autobiography of a Yogi,Paramahansa Yogananda,4.6 out of 5 stars,"3,872",₹99.00
How to Win Friends and Influence People,Dale Carnegie,4.5 out of 5 stars,"51,155",₹95.00
505 Activities for Kids,Dreamland Publications,4.4 out of 5 stars,"3,829",₹193.00
Bhagavad Gita: Yatharoop (Hindi),A.C. Bhaktivendanta Swami Prabhupada,4.7 out of 5 stars,"7,511",₹200.00
Who Will Cry When You Die?,Robin Sharma,4.5 out of 5 stars,"9,729",₹135.00
The Theory of Everything: The Origin and Fate of the Universe,Stephen Hawking,4.6 out of 5 stars,"6,522",₹148.00
Think & Grow Rich,Napoleon Hill,4.5 out of 5 stars,"51,478",₹99.00
"Three Thousand Stitches: Ordinary People, Extraordinary Lives",Sudha Murty,4.6 out of 5 stars,"3,874",₹178.00
Objective NCERT at your Fingertips for NEET-AIIMS - Chemistry,MTG Editorial Board,4.5 out of 5 stars,"1,935",₹470.00
Wren & Martin High School English Grammar and Composition Book (Regular Edition),Rao N,4.5 out of 5 stars,"5,128",₹320.00
Eat That Frog!: 21 Great Ways to Stop Procrastinating and Get More Done in Less Time,Brian Tracy,4.6 out of 5 stars,"3,045",₹160.00
"Thinking, Fast and Slow (Penguin Press Non-Fiction)",Daniel Kahneman,4.4 out of 5 stars,"19,236",₹379.00
Deep Work: Rules for Focused Success in a Distracted World,Cal Newport,4.4 out of 5 stars,"7,213",₹334.00
A Man Called Ove: The life-affirming bestseller that will brighten your day,Fredrik Backman,4.6 out of 5 stars,"27,877",₹257.00
The 12-Week Fitness Project,Rujuta Diwekar,4.4 out of 5 stars,"2,069",₹167.00
India & World Map ( Both Political & Physical ) with Constitution of India Chart & History of India Chart | NON…,Vidya Chitr Prakashan,4.6 out of 5 stars,540,₹160.00
Mandala Art: Colouring Books for Adults with Tear Out Sheets (Adult Colouring Book),Wonder House Books,4.6 out of 5 stars,"1,568",₹129.00
Apke Avchetan Man Ki Shakti (The Power of your Subconscious Mind in Hindi),Joseph Murphy,4.4 out of 5 stars,"3,582",₹99.00
101 Panchatantra Stories,Dreamland Publications,4.3 out of 5 stars,"4,798",₹110.00
Harry Potter and the Philosopher's Stone,J.K. Rowling,4.7 out of 5 stars,"29,166",₹305.00
Amazon Brand - Solimo Board Books for Kids (Set of 10),Solimo,4.6 out of 5 stars,"4,665",₹480.00
To Kill A Mockingbird: 50th Anniversary Edition: 60th Anniversary Edition,Harper Lee,4.5 out of 5 stars,"41,259",₹226.00
All set to Read-A Phonic Reader-Level 1- PHONICS READERS- 6 books in a Box: Box set,Om Books Editorial Team,4.5 out of 5 stars,593,₹487.00
"Brain Games for Clever Kids: Puzzles to Exercise Your Mind (Buster Brain Games, 1)",Gareth Moore,4.3 out of 5 stars,"5,157",₹199.00
Inner Engineering: A Yogi’s Guide to Joy,Sadhguru,4.6 out of 5 stars,"10,424",₹173.00
How to Prepare for Verbal Ability and Reading Comprehension for CAT | 9th Edition,Arun Sharma,4.5 out of 5 stars,"1,013",₹643.00
Brilliant Brain Activity Book 3+,Dreamland Publications,4.6 out of 5 stars,"1,174",₹161.00
Metamorphosis,Franz Kafka,4.5 out of 5 stars,"3,569",₹70.00
Mathematics for Class 9 by R D Sharma (Examination 2021-22),R.D. Sharma,4.6 out of 5 stars,"1,632",₹415.00
Wings of Fire: An Autobiography of Abdul Kalam,Arun Tiwari,4.6 out of 5 stars,"7,911",₹247.00
Certificate Physical And Human Geography; Indian Edition,Goh Cheng Leong,4.5 out of 5 stars,"7,085",₹260.00
1001 Activities Book,Dreamland Publications,4.5 out of 5 stars,"5,007",₹315.00
"Children's Encyclopedia - Scientists, Inventions And Discoveries: The World of Knowledge",MANASVI VOHRA,4.3 out of 5 stars,"2,022",₹127.00
CBSE All In One Science Class 10 for for 2022 Exam,Sanubia & Rashmi Gupta Sonal Singh,4.1 out of 5 stars,124,₹370.00
Think and Grow Rich,Napoleon Hill,4.5 out of 5 stars,"51,478",₹139.00
The Girl in Room 105,Chetan Bhagat,4.3 out of 5 stars,"11,801",₹133.00
CBSE All In One Social Science Class 10 for 2022 Exam,Farah Sultan Madhumitta Pattrea,4.2 out of 5 stars,189,₹340.00
The Diary of a Young Girl,Anne Frank,4.6 out of 5 stars,"3,251",₹99.00
Eating in the Age of Dieting,Rujuta Diwekar,4.6 out of 5 stars,"1,400",₹146.00
"INDIAN ECONOMY For Civil Services, Universities and Other Examinations | 13th Edition",RAMESH SINGH,4.5 out of 5 stars,89,₹499.00
